1,World of tanks,World of Tanks is a massively multiplayer online game developed by Belarusian-Cypriot company Wargaming featuring early to mid-20th century era fighting vehicles
2,Defence of the Ancients 2,Dota 2 is a free-to-play multiplayer online battle arena video game developed and published by Valve Corporation.
3,Counter-Strike: Global Offensive,Counter-Strike: Global Offensive is an online first-person shooter developed by Hidden Path Entertainment and Valve Corporation. It is the fourth game in the main Counter-Strike franchise
4,Transistor,Transistor is a science fiction action role-playing video game developed and published by Supergiant Games.
5,Bioshock,BioShock is a first-person shooter video game developed by 2K Boston and 2K Australia and published by 2K Games.
6,The Elder Scrolls V:Skyrim,The Elder Scrolls V: Skyrim is an action role-playing open world video game developed by Bethesda Game Studios and published by Bethesda Softworks. It is the fifth installment in The Elder Scrolls series following The Elder Scrolls IV: Oblivion.